{
  "$schema": "https://json-schema.org/draft/2020-12/schema",
  "$id": "https://micro-headless-cms.local/schemas/extension.schema.json",
  "title": "Micro Headless CMS Extension Manifest",
  "type": "object",
  "additionalProperties": false,
  "required": ["id", "name", "version", "apiVersion"],
  "properties": {
    "id": {
      "type": "string",
      "pattern": "^[a-z0-9._-]+$"
    },
    "name": {
      "type": "string",
      "minLength": 1
    },
    "version": {
      "type": "string",
      "minLength": 1
    },
    "apiVersion": {
      "type": "string",
      "minLength": 1
    },
    "kind": {
      "type": "string",
      "enum": ["module", "template", "theme"]
    },
    "description": {
      "type": "string"
    },
    "author": {
      "type": "string"
    },
    "website": {
      "type": "string"
    },
    "capabilities": {
      "type": "array",
      "items": { "type": "string" }
    },
    "entrypoints": {
      "type": "object",
      "additionalProperties": false,
      "properties": {
        "adminPage": { "type": "string" },
        "api": { "type": "string" },
        "hooks": { "type": "string" }
      }
    }
  }
}
